{
  "buildingId": "wheeler",
  "referenceLevel": "L1",
  "levels": {
    "B": {
      "rotationHint": 90,
      "anchors": [],
      "transform": {
        "scale": 0.8210941289512396,
        "rotation": 1.5689680265312842,
        "tx": 3211.4898247683327,
        "ty": 197.79251515071735
      },
      "rms": 11.987355334250314
    },
    "M": {
      "rotationHint": 0,
      "anchors": [
        {
          "src": [
            607.2765433550528,
            1082.4049862396082
          ],
          "dst": [
            1822.1065673828125,
            1143.8472900390625
          ]
        },
        {
          "src": [
            1212.3418027747139,
            1044.4184850244674
          ],
          "dst": [
            1817.691162109375,
            729.8959350585938
          ]
        },
        {
          "src": [
            1219.2936998202822,
            1044.2137848711836
          ],
          "dst": [
            1791.8328857421875,
            713.9194946289062
          ]
        },
        {
          "src": [
            603.90331001609,
            1119.3017540849273
          ],
          "dst": [
            1897.0513916015625,
            1176.50537109375
          ]
        },
        {
          "src": [
            572.3180895889366,
            1073.8440463414092
          ],
          "dst": [
            1818.4306640625,
            1178.83056640625
          ]
        },
        {
          "src": [
            716.8916376722077,
            997.1292513577164
          ],
          "dst": [
            1763.5828857421875,
            1079.394775390625
          ]
        },
        {
          "src": [
            800.8158511014942,
            1037.8926140855788
          ],
          "dst": [
            1801.87841796875,
            1007.3114013671875
          ]
        }
      ],
      "transform": {
        "scale": 0.7200766488539033,
        "rotation": -1.579072396152369,
        "tx": 1059.8465260038756,
        "ty": 1600.2489571780566
      },
      "rms": 19.36098995691168
    },
    "L1": {
      "rotationHint": 0,
      "anchors": [],
      "transform": {
        "scale": 1,
        "rotation": 0,
        "tx": 0,
        "ty": 0
      },
      "rms": 0
    },
    "L2": {
      "rotationHint": 270,
      "anchors": [],
      "transform": {
        "scale": 0.817054087436498,
        "rotation": -1.5533301370821397,
        "tx": 1322.0202443450025,
        "ty": 1716.8566078325107
      },
      "rms": 14.33000244469719
    },
    "L3": {
      "rotationHint": 270,
      "anchors": [],
      "transform": {
        "scale": 0.8064353070933264,
        "rotation": -1.56409188647996,
        "tx": 1354.5495997330943,
        "ty": 1727.7629067739572
      },
      "rms": 9.005690236029357
    },
    "L4": {
      "rotationHint": 270,
      "anchors": [],
      "transform": {
        "scale": 0.7346989175995923,
        "rotation": -1.5671637012538664,
        "tx": 1425.965926626077,
        "ty": 1626.0967095646695
      },
      "rms": 32.35907118813378
    }
  },
  "osm": {
    "wayId": 1410826203,
    "origin": {
      "lat": 37.8713007,
      "lon": -122.25915102000002
    },
    "anchors": [],
    "transform": {
      "scale": 0.04781803477639263,
      "rotation": -1.2582198333004921,
      "tx": 7.915428417596084,
      "ty": 119.19910941730119
    },
    "rms": 0.897939941469583
  }
}
